Label,Description,Expression,work_external,work_internal
util_dist_to_nearest_ext_station,Distance to nearest external station,dist_to_external_zone,coef_dist_to_nearest_ext_station,0
util_size_of_nearest_ext_station,Size of nearest external station,"@reindex(land_use.external_work,df.closest_external_zone)",coef_size_of_nearest_ext_station,0
util_child_age,Age of worker,"age",coef_child_age,0
util_income,household income,"income",coef_income,0
util_asc_placeholder,ASC to play with,1,-8,0
util_global_switch,Global switch to have everything internal,@NO_EXTERNAL,-999,0